[
  {
    "sku": "GB-CYL-CLR-9ML-SPR-GLD",
    "filename": "GB-CYL-CLR-9ML-SPR-GLD.png",
    "product_family": "cylinder",
    "frame_class": "tall_narrow",
    "body_shape": "9 ml clear swirl cylinder",
    "body_material": "clear_glass",
    "body_color": "clear swirl",
    "closure_type": "fine_mist_sprayer",
    "closure_material": "white plastic actuator with polished gold collar",
    "cap_color": "clear over-cap with gold collar",
    "collar_material": "polished_gold_metal",
    "applicator_type": "fine_mist_sprayer",
    "detached_components": ["clear_over_cap"],
    "orientation": "front",
    "transparency_type": "transparent",
    "special_geometry_notes": "Spiral molded glass body; detached clear over-cap sits to the right on the same baseline.",
    "reference_image_path": "references/GB-CYL-CLR-9ML-SPR-GLD.png",
    "output_canvas_width": 2080,
    "output_canvas_height": 2288
  },
  {
    "sku": "GB-CYL-CLR-9ML-MRL-SGLD",
    "filename": "GB-CYL-CLR-9ML-MRL-SGLD.png",
    "product_family": "roll_on",
    "frame_class": "tall_narrow",
    "body_shape": "9 ml cylinder roll-on",
    "body_material": "clear_glass",
    "body_color": "clear",
    "closure_type": "metal_roller_ball",
    "closure_material": "metal roller ball with shiny gold cap",
    "cap_color": "shiny gold",
    "collar_material": "polished_gold_metal",
    "applicator_type": "metal_roller_ball",
    "detached_components": [],
    "orientation": "front",
    "transparency_type": "transparent",
    "special_geometry_notes": "Roller ball plug remains seated and centered on neck.",
    "reference_image_path": "references/GB-CYL-CLR-9ML-MRL-SGLD.png",
    "output_canvas_width": 2080,
    "output_canvas_height": 2288
  },
  {
    "sku": "GB-BOS-AMB-30ML-DRP-BLK",
    "filename": "GB-BOS-AMB-30ML-DRP-BLK.png",
    "product_family": "boston_round",
    "frame_class": "medium_upright",
    "body_shape": "30 ml Boston round",
    "body_material": "amber_glass",
    "body_color": "amber",
    "closure_type": "dropper",
    "closure_material": "black rubber bulb and glass pipette",
    "cap_color": "black",
    "collar_material": "black plastic",
    "applicator_type": "dropper",
    "detached_components": [],
    "orientation": "front",
    "transparency_type": "transparent",
    "special_geometry_notes": "Rounded shoulder and dropper bulb must remain exact.",
    "reference_image_path": "references/GB-BOS-AMB-30ML-DRP-BLK.png",
    "output_canvas_width": 2080,
    "output_canvas_height": 2288
  },
  {
    "sku": "GB-SPR-CLR-30ML-SPR-SLV",
    "filename": "GB-SPR-CLR-30ML-SPR-SLV.png",
    "product_family": "classic_spray",
    "frame_class": "medium_upright",
    "body_shape": "30 ml classic spray bottle",
    "body_material": "clear_glass",
    "body_color": "clear",
    "closure_type": "classic_spray_pump",
    "closure_material": "white plastic actuator with polished silver collar",
    "cap_color": "clear",
    "collar_material": "polished_silver_metal",
    "applicator_type": "classic_spray_pump",
    "detached_components": ["clear_over_cap"],
    "orientation": "front",
    "transparency_type": "transparent",
    "special_geometry_notes": "Spray actuator remains exposed; clear over-cap stays visible.",
    "reference_image_path": "references/GB-SPR-CLR-30ML-SPR-SLV.png",
    "output_canvas_width": 2080,
    "output_canvas_height": 2288
  },
  {
    "sku": "GB-ATM-BLK-10ML-SPR-BLK",
    "filename": "GB-ATM-BLK-10ML-SPR-BLK.png",
    "product_family": "atomizer",
    "frame_class": "tall_narrow",
    "body_shape": "10 ml refillable metal atomizer",
    "body_material": "brushed_aluminum",
    "body_color": "black",
    "closure_type": "atomizer_sprayer",
    "closure_material": "black metal atomizer sprayer",
    "cap_color": "black",
    "collar_material": "brushed_aluminum",
    "applicator_type": "atomizer_sprayer",
    "detached_components": [],
    "orientation": "front",
    "transparency_type": "opaque",
    "special_geometry_notes": "Opaque metal shell; no transparent interior.",
    "reference_image_path": "references/GB-ATM-BLK-10ML-SPR-BLK.png",
    "output_canvas_width": 2080,
    "output_canvas_height": 2288
  },
  {
    "sku": "GB-VIN-CLR-30ML-BLB-TAS",
    "filename": "GB-VIN-CLR-30ML-BLB-TAS.png",
    "product_family": "vintage_bulb_sprayer",
    "frame_class": "decorative_silhouette",
    "body_shape": "decorative clear bottle with vintage bulb sprayer",
    "body_material": "clear_glass",
    "body_color": "clear",
    "closure_type": "vintage_bulb_sprayer",
    "closure_material": "rubber bulb, textile hose, tassel, metal collar",
    "cap_color": "gold",
    "collar_material": "polished_gold_metal",
    "applicator_type": "vintage_bulb_sprayer",
    "detached_components": ["hose", "tassel", "bulb"],
    "orientation": "front_slight_right",
    "transparency_type": "mixed",
    "special_geometry_notes": "Bulb, hose, and tassel must remain fully visible.",
    "reference_image_path": "references/GB-VIN-CLR-30ML-BLB-TAS.png",
    "output_canvas_width": 2080,
    "output_canvas_height": 2288
  },
  {
    "sku": "GB-VIA-CLR-1ML-SCR-WHT",
    "filename": "GB-VIA-CLR-1ML-SCR-WHT.png",
    "product_family": "vial",
    "frame_class": "tall_narrow",
    "body_shape": "1 ml clear vial",
    "body_material": "clear_glass",
    "body_color": "clear",
    "closure_type": "screw_cap",
    "closure_material": "white plastic screw cap",
    "cap_color": "white",
    "collar_material": "white plastic",
    "applicator_type": "screw_cap",
    "detached_components": [],
    "orientation": "front",
    "transparency_type": "transparent",
    "special_geometry_notes": "Tiny vial scale must remain small and narrow.",
    "reference_image_path": "references/GB-VIA-CLR-1ML-SCR-WHT.png",
    "output_canvas_width": 2080,
    "output_canvas_height": 2288
  },
  {
    "sku": "GB-APO-AMB-60ML-SCR-BLK",
    "filename": "GB-APO-AMB-60ML-SCR-BLK.png",
    "product_family": "apothecary_bottle",
    "frame_class": "medium_upright",
    "body_shape": "amber apothecary bottle",
    "body_material": "amber_glass",
    "body_color": "amber",
    "closure_type": "screw_cap",
    "closure_material": "black plastic cap",
    "cap_color": "black",
    "collar_material": "black plastic",
    "applicator_type": "screw_cap",
    "detached_components": [],
    "orientation": "front",
    "transparency_type": "transparent",
    "special_geometry_notes": "Apothecary shoulder curve and amber body density must remain.",
    "reference_image_path": "references/GB-APO-AMB-60ML-SCR-BLK.png",
    "output_canvas_width": 2080,
    "output_canvas_height": 2288
  },
  {
    "sku": "GB-JAR-WHT-50ML-SCR-WHT",
    "filename": "GB-JAR-WHT-50ML-SCR-WHT.png",
    "product_family": "cream_jar",
    "frame_class": "low_wide_jar",
    "body_shape": "50 ml low wide cream jar",
    "body_material": "white_plastic",
    "body_color": "white",
    "closure_type": "screw_cap",
    "closure_material": "white plastic lid",
    "cap_color": "white",
    "collar_material": "white plastic",
    "applicator_type": "screw_cap",
    "detached_components": [],
    "orientation": "front",
    "transparency_type": "opaque",
    "special_geometry_notes": "Low wide jar stance and lid diameter must remain.",
    "reference_image_path": "references/GB-JAR-WHT-50ML-SCR-WHT.png",
    "output_canvas_width": 2080,
    "output_canvas_height": 2288
  },
  {
    "sku": "GB-BOX-WHT-30ML-CARTON",
    "filename": "GB-BOX-WHT-30ML-CARTON.png",
    "product_family": "box",
    "frame_class": "box_or_bag",
    "body_shape": "folding carton box",
    "body_material": "folding_carton_paperboard",
    "body_color": "white",
    "closure_type": "none",
    "closure_material": "paperboard flaps",
    "cap_color": "none",
    "collar_material": "none",
    "applicator_type": "none",
    "detached_components": [],
    "orientation": "front",
    "transparency_type": "paperboard",
    "special_geometry_notes": "Preserve panel proportions, folds, edges, and blank no-label surface.",
    "reference_image_path": "references/GB-BOX-WHT-30ML-CARTON.png",
    "output_canvas_width": 2080,
    "output_canvas_height": 2288
  }
]
